{
  "$schema": "https://json-schema.org/draft/2020-12/schema",
  "$id": "https://devshelf.ritualdev.in/schemas/free-cloud.schema.json",
  "title": "DevShelf Free Cloud Service",
  "description": "Schema for cloud databases, hosting, and backend services with perpetual free tiers",
  "type": "array",
  "items": {
    "type": "object",
    "required": ["name", "url", "category", "description", "freeTier"],
    "properties": {
      "name": {
        "type": "string",
        "minLength": 2,
        "description": "Name of the cloud platform or service"
      },
      "url": {
        "type": "string",
        "format": "uri",
        "pattern": "^https?://",
        "description": "Official website or pricing page URL"
      },
      "category": {
        "type": "string",
        "description": "Cloud service category (e.g. Databases & BaaS, Cloud Hosting & PaaS)"
      },
      "description": {
        "type": "string",
        "minLength": 10,
        "maxLength": 300,
        "description": "Objective explanation of the platform capabilities"
      },
      "freeTier": {
        "type": "string",
        "minLength": 5,
        "description": "Detailed specification of the non-expiring free allowance"
      },
      "featured": {
        "type": "boolean",
        "description": "Whether this tool is highlighted in weekly spotlights"
      },
      "sponsorTier": {
        "type": "string",
        "description": "Optional verified sponsor tier metadata"
      },
      "statusTags": {
        "type": "array",
        "items": { "type": "string" },
        "description": "Optional telemetry status tags"
      },
      "lastCheckedAt": {
        "type": "string",
        "description": "ISO timestamp of most recent HTTP endpoint reachability check"
      },
      "lastVerifiedAt": {
        "type": "string",
        "description": "ISO timestamp when entry existence was verified by maintainer or automated pipeline"
      },
      "pricingVerifiedAt": {
        "type": "string",
        "description": "ISO timestamp when zero-paywall pricing terms and free tier were verified"
      },
      "healthStatus": {
        "type": "string",
        "enum": ["healthy", "degraded", "down", "redirected", "bot_challenge", "unknown"],
        "description": "Live endpoint operational status"
      },
      "authRequirements": {
        "type": "string",
        "description": "Detailed authentication requirement (e.g. none, free api key, oauth, registration)"
      },
      "freeTierLimits": {
        "type": "string",
        "description": "Specific free tier limits or perpetual zero-cost quotas"
      },
      "verifiedZeroPaywall": {
        "type": "boolean",
        "description": "Whether the resource is verified to have an authentic, permanent zero-paywall tier"
      },
      "redirectUrl": {
        "type": "string",
        "format": "uri",
        "pattern": "^https?://",
        "description": "Tracked redirect target URL if destination moved"
      }
    },
    "additionalProperties": false
  }
}
