[
  {
    "name": "Supabase",
    "url": "https://supabase.com",
    "category": "Databases & BaaS",
    "description": "Open source Firebase alternative providing PostgreSQL, Auth, Instant APIs, Realtime subscriptions, and Storage.",
    "freeTier": "500MB DB, 50k monthly active users, 1GB storage",
    "statusTags": ["No Card Required", "CI Verified"]
  },
  {
    "name": "Neon",
    "url": "https://neon.tech",
    "category": "Databases & BaaS",
    "description": "Serverless Postgres with instant branching, bottomless storage, and autoscaling compute to zero.",
    "freeTier": "0.5 GB storage, instant branching, scale-to-zero",
    "statusTags": ["Requires Credit Card to Verify", "CI Verified"]
  },
  {
    "name": "Cloudflare Workers",
    "url": "https://workers.cloudflare.com",
    "category": "Cloud Hosting & PaaS",
    "description": "Deploy serverless code instantly across Cloudflare's global edge network with ultra-low latency.",
    "freeTier": "100,000 requests/day, KV store, D1 SQL database",
    "statusTags": ["Requires Credit Card to Verify", "CI Verified"]
  },
  {
    "name": "Clerk",
    "url": "https://clerk.com",
    "category": "Authentication & Security",
    "description": "Complete user management and authentication suite for React, Next.js, and modern full-stack web applications.",
    "freeTier": "10,000 monthly active users, social logins, MFA",
    "statusTags": ["Requires Credit Card to Verify", "CI Verified"]
  },
  {
    "name": "Resend",
    "url": "https://resend.com",
    "category": "Transactional Email",
    "description": "Developer-first email platform for sending transactional emails using clean React components.",
    "freeTier": "3,000 emails/month, 100 emails/day, 1 custom domain",
    "statusTags": ["Requires Credit Card to Verify", "CI Verified"]
  },
  {
    "name": "PocketBase",
    "url": "https://pocketbase.io",
    "category": "Databases & BaaS",
    "description": "Open source backend in 1 file consisting of embedded SQLite database with real-time subscriptions, built-in auth, and admin dashboard.",
    "freeTier": "100% Free & Open Source, single binary self-hostable",
    "statusTags": ["Requires Credit Card to Verify", "CI Verified"]
  },
  {
    "name": "Appwrite",
    "url": "https://appwrite.io",
    "category": "Databases & BaaS",
    "description": "Self-hosted backend-as-a-service platform providing developers with core APIs for authentication, databases, storage, and serverless functions.",
    "freeTier": "Free Cloud Tier: 2 projects, 75k monthly active users, 2GB storage",
    "statusTags": ["Requires Credit Card to Verify", "CI Verified"]
  },
  {
    "name": "Fly.io",
    "url": "https://fly.io",
    "category": "Cloud Hosting & PaaS",
    "description": "Run full-stack apps and databases close to your users globally with lightweight Firecracker microVMs.",
    "freeTier": "Free allowance: up to 3 shared-cpu-1x VMs, 3GB persistent storage",
    "statusTags": ["Requires Credit Card to Verify", "CI Verified"]
  },
  {
    "name": "Render",
    "url": "https://render.com",
    "category": "Cloud Hosting & PaaS",
    "description": "Unified cloud to build and run web applications, APIs, static sites, and background workers with automated Git deploys.",
    "freeTier": "Free static sites, free web services (750 hrs/mo), free PostgreSQL",
    "statusTags": ["Requires Credit Card to Verify", "CI Verified"]
  },
  {
    "name": "Koyeb",
    "url": "https://www.koyeb.com",
    "category": "Cloud Hosting & PaaS",
    "description": "Serverless platform to deploy full-stack apps and Docker containers globally with built-in CDN, SSL, and private networking.",
    "freeTier": "Free Eco tier: 1 web service, 512MB RAM, global edge network",
    "statusTags": ["No Card Required", "CI Verified"]
  },
  {
    "name": "Auth.js",
    "url": "https://authjs.dev",
    "category": "Authentication & Security",
    "description": "Complete open-source authentication library for Next.js, SvelteKit, Express, and modern frameworks with zero vendor lock-in.",
    "freeTier": "100% Free & Open Source, self-hostable with unlimited users",
    "statusTags": ["No Card Required", "CI Verified"]
  },
  {
    "name": "Better Auth",
    "url": "https://better-auth.com",
    "category": "Authentication & Security",
    "description": "Comprehensive TypeScript-first open-source authentication framework supporting multi-factor auth, organizations, and plugins.",
    "freeTier": "100% Free & Open Source framework",
    "statusTags": ["No Card Required", "CI Verified"]
  },
  {
    "name": "Lucia",
    "url": "https://lucia-auth.com",
    "category": "Authentication & Security",
    "description": "Flexible and lightweight open-source authentication and session handling resource for modern web applications.",
    "freeTier": "100% Free & Open Source",
    "statusTags": ["No Card Required", "CI Verified"]
  },
  {
    "name": "SuperTokens",
    "url": "https://supertokens.com",
    "category": "Authentication & Security",
    "description": "Open-source alternative to Auth0 and Firebase Auth providing passwordless, social login, session management, and user roles.",
    "freeTier": "Free self-hosted community edition; Free cloud tier up to 5,000 MAU",
    "statusTags": ["No Card Required", "CI Verified"]
  },
  {
    "name": "Logto",
    "url": "https://logto.io",
    "category": "Authentication & Security",
    "description": "Modern open-source identity and access management infrastructure with OIDC, OAuth 2.0, and pre-built sign-in UI.",
    "freeTier": "Free self-hosted version; Free cloud tier for up to 50k MAU",
    "statusTags": ["No Card Required", "CI Verified"]
  },
  {
    "name": "Coolify",
    "url": "https://coolify.io",
    "category": "Self-Hosted Cloud & PaaS",
    "description": "Self-hostable, open-source all-in-one alternative to Heroku, Netlify, and Vercel for applications, databases, and services.",
    "freeTier": "100% Free & Open Source self-hosted on your own server or VPS",
    "statusTags": ["No Card Required", "CI Verified"]
  },
  {
    "name": "Dokku",
    "url": "https://dokku.com",
    "category": "Self-Hosted Cloud & PaaS",
    "description": "Smallest PaaS implementation powered by Docker, allowing Git push-to-deploy on your own single server.",
    "freeTier": "100% Free & Open Source",
    "statusTags": ["No Card Required", "CI Verified"]
  },
  {
    "name": "CapRover",
    "url": "https://caprover.com",
    "category": "Self-Hosted Cloud & PaaS",
    "description": "Extremely easy-to-use open-source app and database deployment platform with automated SSL and 1-click apps.",
    "freeTier": "100% Free & Open Source",
    "statusTags": ["No Card Required", "CI Verified"]
  },
  {
    "name": "Easypanel",
    "url": "https://easypanel.io",
    "category": "Self-Hosted Cloud & PaaS",
    "description": "Proprietary self-hosted control panel for deploying applications and databases with Docker, automatic SSL and a browser interface.",
    "freeTier": "Free forever: up to 3 projects, unlimited services and deployments, basic monitoring. Requires your own server; hosting costs are separate.",
    "statusTags": ["Self-Hostable", "No Card Required"]
  },
  {
    "name": "Turso",
    "url": "https://turso.tech",
    "category": "Databases & BaaS",
    "description": "Distributed SQLite database powered by libSQL designed for low-latency queries at the edge.",
    "freeTier": "Free Starter Tier: 9GB storage, 500 databases, and 1B row reads/mo",
    "statusTags": ["No Card Required", "CI Verified"]
  },
  {
    "name": "Upstash",
    "url": "https://upstash.com",
    "category": "Databases & BaaS",
    "description": "Serverless data platform providing Redis, Apache Kafka, and QStash with per-request pricing and instant scaling.",
    "freeTier": "10,000 commands/day free for Redis, 10,000 messages/day for Kafka",
    "statusTags": ["No Card Required", "CI Verified"]
  },
  {
    "name": "PostHog",
    "url": "https://posthog.com",
    "category": "Observability & Analytics",
    "description": "Open-source product analytics suite combining web analytics, session replays, feature flags, and survey tools.",
    "freeTier": "1,000,000 events/month, 5,000 session recordings/month permanently free",
    "statusTags": ["No Card Required", "CI Verified"]
  },
  {
    "name": "Umami",
    "url": "https://umami.is",
    "category": "Observability & Analytics",
    "description": "Privacy-focused, cookie-free open-source web analytics platform with a fast and intuitive dashboard.",
    "freeTier": "100% Free & Open Source self-hosted; Free cloud tier available",
    "statusTags": ["No Card Required", "CI Verified"]
  },
  {
    "name": "Directus",
    "url": "https://directus.io",
    "category": "Databases & BaaS",
    "description": "Real-time API and app dashboard layer for any SQL database with granular access control and event automation.",
    "freeTier": "100% Free & Open Source Community Edition",
    "statusTags": ["No Card Required", "CI Verified"]
  },
  {
    "name": "Strapi",
    "url": "https://strapi.io",
    "category": "Databases & BaaS",
    "description": "Open-source headless CMS delivering customizable REST and GraphQL APIs for web and mobile frontends.",
    "freeTier": "100% Free & Open Source Community Edition",
    "statusTags": ["No Card Required", "CI Verified"]
  },
  {
    "name": "MinIO",
    "url": "https://min.io",
    "category": "Storage & Buckets",
    "description": "High-performance, S3-compatible open-source object storage suite designed for high-density cloud data.",
    "freeTier": "100% Free & Open Source GNU AGPLv3",
    "statusTags": ["No Card Required", "CI Verified"]
  },
  {
    "name": "GlitchTip",
    "url": "https://glitchtip.com",
    "category": "Observability & Analytics",
    "description": "Open-source, self-hosted error tracking system compatible with Sentry client libraries and SDKs.",